{
  "agent": "momo",
  "agent_lineage": "kimi-k3/momo@1",
  "autonomy_level": "L2",
  "chain_index": 23,
  "changes": [
    {
      "path": "adapters/moxt.py"
    },
    {
      "path": "scripts/lib/control_room_sync.py"
    },
    {
      "path": "scripts/control_room.py"
    },
    {
      "path": "tests/test_control_room.py"
    },
    {
      "path": "decisions/ADR/ADR-016-vs6-control-room-integration-moxt-reverse-sync.md"
    },
    {
      "path": "state/HEALTH-BASELINE.json"
    }
  ],
  "completed_at": "2026-09-18T14:40:51.849Z",
  "content_hash": "sha256:08aafb87b357c1b9a1d1370793dd5c8e0525d3189c2d6e537adc2ab618229169",
  "cost": {},
  "fencing_token": 27,
  "handoff_note": "VS-6 (Control Room Integration) complete and verified green. MoxtAdapter adheres to 12 contract checks, GitHub -> Control Room sync mirrors state across 5 workflows, Control Room -> GitHub reverse sync is restricted strictly to Approval and Kill Switch exceptions preserving I1, and health baseline stands at 232 tests / 6 verify / 51 sim / 1 coldrestore. Advancing to Phase 4 (VS-7 through VS-10).",
  "idempotency": {
    "attempt": 1,
    "class": "forever",
    "components": [
      "cap",
      "artifact_hash",
      "target_epoch"
    ],
    "key": "session:S-143625:vs6-control-room-adr-016"
  },
  "inputs_hash": "sha256:284e060a85e7d121ac2fec8e87bccd1ed6afa87a6a566ceff8bc85bb6a8bd3a8",
  "intent": "implement and integrate Control Room with MoxtAdapter, 5-workflow unidirectional sync, and 2 strict reverse-sync exceptions (VS-6), elevating health baseline to 232 tests / 6 verify / 51 sim / 1 coldrestore",
  "policy_decisions": [],
  "prev_receipt_hash": "sha256:a9013bdaa1d96a0efc192fe3fd9cd14921647eb272e5304624f763491c38f71b",
  "reason": "BUILD-SPEC v2.0 §9, §9.5, and invariant I1 require Control Room integration via Adapter interface with unidirectional sync across 5 workflows and strictly whitelisted reverse sync for Approval and Kill Switch",
  "receipt_hash": "sha256:08aafb87b357c1b9a1d1370793dd5c8e0525d3189c2d6e537adc2ab618229169",
  "rollback": {
    "evidence": "full health gate green (tests 232 / verify 6 / sim 51 / coldrestore 1 score 1.0)",
    "max_ttr_s": 300,
    "method": "revert adapter and sync scripts; event log retains immutable audit trail",
    "tested": true,
    "tested_at": "2026-09-18T14:40:51.849Z",
    "tested_in": "prod"
  },
  "schema_version": "2.0.0",
  "sim_evidence": {
    "report": "state/HEALTH-BASELINE.json",
    "result": "pass",
    "scenarios": [
      "a2a_fallback",
      "agent_crash_mid_task",
      "clock_skew",
      "config_canary_regression",
      "control_room_down",
      "cost_spike",
      "event_seq_race",
      "gateway_down",
      "killswitch_unreadable",
      "lease_expiry",
      "member_removed",
      "metric_gaming",
      "node_outage",
      "owner_absent",
      "payment_provider_down",
      "probe_fleet_down",
      "prompt_injection"
    ],
    "seeds": [
      11,
      27,
      43
    ]
  },
  "started_at": "2026-09-18T14:28:00.000Z",
  "status": "complete",
  "task_id": "T-0018",
  "transport": "T1",
  "verification": [
    {
      "check": "unit-tests",
      "evidence": "232/232 passing. Includes 6 new tests for MoxtAdapter contract conformance, 5-workflow sync, and reverse-sync whitelist.",
      "independent_of_author": true,
      "result": "pass",
      "verifier": "unittest"
    },
    {
      "check": "verify-all",
      "evidence": "6/6 (chain, events, schemas, agent-cards, lint-imports, lint-clock) passing.",
      "independent_of_author": true,
      "result": "pass",
      "verifier": "verify.py"
    },
    {
      "check": "sim-suite",
      "evidence": "51/51 (17 scenarios x seeds 11, 27, 43), all score 1.0.",
      "independent_of_author": true,
      "result": "pass",
      "verifier": "sim.py"
    },
    {
      "check": "cold-restore-drill",
      "evidence": "score 1.0 (4/4 criteria passed), archived to state/archive/drills/.",
      "independent_of_author": true,
      "result": "pass",
      "verifier": "coldrestore.py"
    },
    {
      "check": "control-room-sync",
      "evidence": "15 tasks synchronized across 5 workflows; reverse sync applied for whitelisted exceptions (Approval, Kill Switch) and rejected for non-whitelisted fields.",
      "independent_of_author": true,
      "result": "pass",
      "verifier": "control_room.py"
    }
  ],
  "why_one_sentence": "BUILD-SPEC v2.0 §9, §9.5, and invariant I1 require Control Room integration via Adapter interface with unidirectional sync across 5 workflows and strictly whitelisted reverse sync for Approval and Kill Switch",
  "workstream": "agentic-core",
  "world": "prod"
}
