{
  "agent": "momo",
  "agent_lineage": "kimi-k3/momo@1",
  "autonomy_level": "L2",
  "chain_index": 26,
  "changes": [
    {
      "path": "scripts/lib/experiments.py"
    },
    {
      "path": "scripts/experiment.py"
    },
    {
      "path": "scripts/lib/events.py"
    },
    {
      "path": "analytics/schemas/event.schema.json"
    },
    {
      "path": "scripts/compact.py"
    },
    {
      "path": "tests/test_experiment_engine.py"
    },
    {
      "path": "decisions/ADR/ADR-019-vs9-safe-experimentation-srm-guardrails-negative-results.md"
    },
    {
      "path": "state/HEALTH-BASELINE.json"
    }
  ],
  "completed_at": "2026-09-18T15:27:56.044Z",
  "content_hash": "sha256:25fb7a9c0d6c9fdda650ab98c8ee82c38172834f11ec0f39a61f2bd6ee45587f",
  "cost": {},
  "fencing_token": 30,
  "handoff_note": "VS-9 (Safe Experimentation) complete and verified green. SRM detection (alpha=0.001), real-time guardrail auto-stop, always-valid p-values, mandatory negative results, and Tick-D state sense are fully operational. Health baseline elevated to 249 tests / 6 verify / 51 sim / 1 coldrestore. Ready for transition to VS-10 (Revenue & Economic Dashboards).",
  "idempotency": {
    "attempt": 1,
    "class": "forever",
    "components": [
      "cap",
      "artifact_hash",
      "target_epoch"
    ],
    "key": "session:S-152320:vs9-safe-experimentation-adr-019"
  },
  "inputs_hash": "sha256:89e654aa7ca9edd6b2c0c21556543aa10daea935f00345c174cb2636daec6727",
  "intent": "implement and activate Safe Experimentation & Readout Loop (VS-9): Chi-square Sample Ratio Mismatch (SRM) detection (alpha=0.001), real-time Guardrail Auto-Stop (I12 fail-closed on secondary metrics), sequential always-valid p-values with sample-size gating (n >= n_min), mandatory negative results recording (I21), experiment CLI, state sense elevation to Tick-D, raising baseline to 249 unit tests / 6 verify / 51 sim / 1 coldrestore",
  "policy_decisions": [],
  "prev_receipt_hash": "sha256:81e99ce0dfe8992f566ea09c02c83eb5022459313cfd1fba5c760d49be81ec0f",
  "reason": "BUILD-SPEC v2.0 §13.4, §12.0, and §3 require safe experimentation gating, SRM sample bias detection, and survivorship bias prevention through negative results recording before scaling mutations",
  "receipt_hash": "sha256:25fb7a9c0d6c9fdda650ab98c8ee82c38172834f11ec0f39a61f2bd6ee45587f",
  "rollback": {
    "evidence": "full health gate green (tests 249 / verify 6 / sim 51 / coldrestore 1 score 1.0)",
    "max_ttr_s": 300,
    "method": "revert experiment engine modules; persisted experiment logs retain immutable post-mortem record",
    "tested": true,
    "tested_at": "2026-09-18T15:27:56.044Z",
    "tested_in": "prod"
  },
  "schema_version": "2.0.0",
  "sim_evidence": {
    "report": "state/HEALTH-BASELINE.json",
    "result": "pass",
    "scenarios": [
      "a2a_fallback",
      "agent_crash_mid_task",
      "clock_skew",
      "config_canary_regression",
      "control_room_down",
      "cost_spike",
      "event_seq_race",
      "gateway_down",
      "killswitch_unreadable",
      "lease_expiry",
      "member_removed",
      "metric_gaming",
      "node_outage",
      "owner_absent",
      "payment_provider_down",
      "probe_fleet_down",
      "prompt_injection"
    ],
    "seeds": [
      11,
      27,
      43
    ]
  },
  "started_at": "2026-09-18T15:20:00.000Z",
  "status": "complete",
  "task_id": "T-0021",
  "transport": "T1",
  "verification": [
    {
      "check": "unit-tests",
      "evidence": "249/249 passing. Includes 5 new tests for SRM detection, guardrail breaches, sequential p-values, and negative results.",
      "independent_of_author": true,
      "result": "pass",
      "verifier": "unittest"
    },
    {
      "check": "verify-all",
      "evidence": "6/6 (chain, events, schemas, agent-cards, lint-imports, lint-clock) passing.",
      "independent_of_author": true,
      "result": "pass",
      "verifier": "verify.py"
    },
    {
      "check": "sim-suite",
      "evidence": "51/51 (17 scenarios x seeds 11, 27, 43), all score 1.0.",
      "independent_of_author": true,
      "result": "pass",
      "verifier": "sim.py"
    },
    {
      "check": "cold-restore-drill",
      "evidence": "score 1.0 (4/4 criteria passed), archived to state/archive/drills/.",
      "independent_of_author": true,
      "result": "pass",
      "verifier": "coldrestore.py"
    },
    {
      "check": "safe-experimentation",
      "evidence": "Validated SRM chi-square detection, guardrail auto-stop, always-valid sequential p-values, and negative results recording via experiment.py CLI and test suite.",
      "independent_of_author": true,
      "result": "pass",
      "verifier": "experiment.py"
    }
  ],
  "why_one_sentence": "BUILD-SPEC v2.0 §13.4, §12.0, and §3 require safe experimentation gating, SRM sample bias detection, and survivorship bias prevention through negative results recording before scaling mutations",
  "workstream": "agentic-core",
  "world": "prod"
}
