{
  "agent": "momo",
  "agent_lineage": "kimi-k3/momo@1",
  "autonomy_level": "L2",
  "chain_index": 14,
  "changes": [
    {
      "path": "scripts/lib/receipts.py"
    },
    {
      "path": "scripts/compact.py"
    },
    {
      "path": "tests/test_lib.py"
    },
    {
      "path": "decisions/ADR/ADR-007-crash-rate-window-and-tested-in-gate.md"
    },
    {
      "path": "state/HEALTH-BASELINE.json"
    },
    {
      "path": "artifacts/sim/VS4-session3-health.json"
    },
    {
      "path": "state/HANDOFF.md"
    },
    {
      "path": "CONTEXT-PACK.md"
    }
  ],
  "completed_at": "2026-08-02T14:06:42.990Z",
  "content_hash": "sha256:118c04e7d7b843acfbfb7de305d9de3b4d011c27c53ad2754c68889f57899259",
  "cost": {},
  "fencing_token": 15,
  "handoff_note": "O1 (crash_rate KPI) is closed as a code defect; the 0.02 budget and the 50-receipt window remain Owner-reviewable constants in scripts/lib/receipts.py. O3 is NOT closed and cannot be closed by an agent: connecting the GitHub repo is a human action in v0 settings. VS-4 remains open: succession workflow, escrow/mirror, dead-man prod wiring (O4), drill scheduling, 6 remaining §16 scenarios",
  "idempotency": {
    "attempt": 1,
    "class": "forever",
    "components": [
      "cap",
      "artifact_hash",
      "target_epoch"
    ],
    "key": "session:S-140043:crash-rate-window-adr-007"
  },
  "inputs_hash": "sha256:027d9a6be6105b62d52bcfd47bdbc30869301bceb3ebebc9947c05dcbd4d5d39",
  "intent": "close the crash_rate KPI defect under delegated authority: measure the 2% budget over a trailing 50-receipt window instead of all history, and publish lifetime + sample-size fields alongside it (ADR-007 D42/D43)",
  "policy_decisions": [],
  "prev_receipt_hash": "sha256:ba00c47b31dd59bbc6905ae61f65b8f95a106a046dcc949e5fae777ac8269200",
  "reason": "lifetime crashes / lifetime receipts is a ratchet: 4 tombstones held the gate red until 200 receipts existed, so the only way to green was deleting tombstones (G18/§3.2 violation pressure). Owner's 0.02 budget was left untouched — only the measurement window is mine to decide",
  "receipt_hash": "sha256:118c04e7d7b843acfbfb7de305d9de3b4d011c27c53ad2754c68889f57899259",
  "rollback": {
    "evidence": "full gate suite + drill green after the edit; stats() signature kept backward-compatible (window arg optional), all 4 call sites unchanged",
    "max_ttr_s": 300,
    "method": "revert scripts/lib/receipts.py stats() to the lifetime formula, drop the 4 KPI fields from compact.py, restore the 149-test baseline; no receipt data is mutated by this change so there is nothing to un-migrate",
    "tested": true,
    "tested_at": "2026-08-02T14:06:42.990Z",
    "tested_in": "prod"
  },
  "schema_version": "2.0.0",
  "sim_evidence": {
    "report": "artifacts/sim/VS4-session3-health.json",
    "result": "pass",
    "scenarios": [
      "event_seq_race",
      "killswitch_unreadable",
      "owner_absent",
      "lease_expiry",
      "agent_crash_mid_task",
      "node_outage",
      "cost_spike",
      "prompt_injection",
      "a2a_fallback",
      "payment_provider_down"
    ],
    "seeds": [
      11,
      27,
      43
    ]
  },
  "started_at": "2026-08-02T14:00:43.000Z",
  "status": "complete",
  "task_id": "T-0011",
  "transport": "T1",
  "verification": [
    {
      "check": "unit-tests",
      "evidence": "153/153; 3 new KPI tests went RED first (AttributeError CRASH_WINDOW / KeyError sample_sufficient), incl. test_crash_rate_window_counts_recent_crashes proving the window cannot hide current crashes",
      "independent_of_author": true,
      "result": "pass",
      "verifier": "unittest"
    },
    {
      "check": "verify-all",
      "evidence": "6/6",
      "independent_of_author": true,
      "result": "pass",
      "verifier": "verify.py"
    },
    {
      "check": "sim-suite",
      "evidence": "30/30 (10 scenarios x seeds 11,27,43)",
      "independent_of_author": true,
      "result": "pass",
      "verifier": "sim-harness"
    },
    {
      "check": "cold-restore-drill",
      "evidence": "4/4 score=1.0",
      "independent_of_author": true,
      "result": "pass",
      "verifier": "coldrestore.py"
    },
    {
      "check": "no-laundering",
      "evidence": "crash_rate still 0.2857 and crash_rate_ok still false today (window=50 > 14 receipts); crashed_lifetime=4 retained in payload and STATE.json. This change made nothing green.",
      "independent_of_author": false,
      "metric": {
        "crash_rate": 0.2857,
        "crash_rate_lifetime": 0.2857,
        "crashed_lifetime": 4,
        "sample_sufficient": false,
        "window_size": 14
      },
      "result": "pass",
      "verifier": "receipts.stats()"
    }
  ],
  "why_one_sentence": "lifetime crashes / lifetime receipts is a ratchet: 4 tombstones held the gate red until 200 receipts existed, so the only way to green was deleting tombstones (G18/§3.2 violation pressure). Owner's 0.02 budget was left untouched — only the measurement window is mine to decide",
  "workstream": "agentic-core",
  "world": "prod"
}
