{
  "agent": "momo",
  "agent_lineage": "kimi-k3/momo@1",
  "autonomy_level": "L2",
  "chain_index": 13,
  "changes": [
    {
      "path": "scripts/coldrestore.py"
    },
    {
      "path": "tests/test_scripts.py"
    },
    {
      "path": "state/HEALTH-BASELINE.json"
    },
    {
      "path": "artifacts/sim/VS4-session2-health.json"
    },
    {
      "path": "state/HANDOFF.md"
    },
    {
      "path": "CONTEXT-PACK.md"
    }
  ],
  "completed_at": "2026-08-02T13:55:04.449Z",
  "content_hash": "sha256:ba00c47b31dd59bbc6905ae61f65b8f95a106a046dcc949e5fae777ac8269200",
  "cost": {},
  "fencing_token": 14,
  "handoff_note": "regression closed; health.py (added in aborted session S-165126, previously unreceipted) is now covered by a saved baseline. VS-4 open: succession workflow, escrow/mirror, dead-man prod wiring (O4), drill scheduling, 6 remaining §16 scenarios",
  "idempotency": {
    "attempt": 1,
    "class": "forever",
    "components": [
      "cap",
      "artifact_hash",
      "target_epoch"
    ],
    "key": "session:S-135048:coldrestore-tested-in-regression"
  },
  "inputs_hash": "sha256:bf62c9c233c0f4b84a06bd6215946574e07ee18a0284576b3ec9ab8d90dc165e",
  "intent": "fix the coldrestore.py rollback.tested_in='mirror' regression that made the §11.2 drill receipt unwritable, and add a static gate pinning every tested_in call site to the schema enum",
  "policy_decisions": [],
  "prev_receipt_hash": "sha256:944eeb11d9c9b4b70396b2b9406a3f78ce8030daee454c1fd857bf83a1c6fad7",
  "reason": "the drill scored 1.0 in HANDOFF but could no longer write its criterion-4 receipt; the 149/149 suite stayed green because no test covered the call site (§3.3, I15)",
  "receipt_hash": "sha256:ba00c47b31dd59bbc6905ae61f65b8f95a106a046dcc949e5fae777ac8269200",
  "rollback": {
    "evidence": "full gate suite + drill re-run green after the edit",
    "max_ttr_s": 300,
    "method": "revert two file edits (scripts/coldrestore.py, tests/test_scripts.py) and restore the 149-test baseline; no external system touched",
    "tested": true,
    "tested_at": "2026-08-02T13:55:04.449Z",
    "tested_in": "prod"
  },
  "schema_version": "2.0.0",
  "sim_evidence": {
    "report": "artifacts/sim/VS4-session2-health.json",
    "result": "pass",
    "scenarios": [
      "event_seq_race",
      "killswitch_unreadable",
      "owner_absent",
      "lease_expiry",
      "agent_crash_mid_task",
      "node_outage",
      "cost_spike",
      "prompt_injection",
      "a2a_fallback",
      "payment_provider_down"
    ],
    "seeds": [
      11,
      27,
      43
    ]
  },
  "started_at": "2026-08-02T13:50:48.000Z",
  "status": "complete",
  "task_id": "T-0010",
  "transport": "T1",
  "verification": [
    {
      "check": "unit-tests",
      "evidence": "health.py -> tests 150/150 (new TestRollbackTestedInCallSites went RED on coldrestore.py:241 before the fix)",
      "independent_of_author": true,
      "result": "pass",
      "verifier": "unittest"
    },
    {
      "check": "verify-all",
      "evidence": "health.py -> verify 6/6",
      "independent_of_author": true,
      "result": "pass",
      "verifier": "verify.py"
    },
    {
      "check": "sim-suite",
      "evidence": "health.py -> sim 30/30 (10 scenarios x seeds 11,27,43)",
      "independent_of_author": true,
      "result": "pass",
      "verifier": "sim-harness"
    },
    {
      "check": "cold-restore-drill",
      "evidence": "scripts/coldrestore.py run -> 4/4 score 1.0; archive state/archive/drills/cold-restore-2026-08-02T135441Z.json (criterion 4 receipt writes again)",
      "independent_of_author": true,
      "result": "pass",
      "verifier": "coldrestore.py"
    },
    {
      "check": "health-baseline",
      "evidence": "new green floor tests=150 verify=6 sim=30 saved to state/HEALTH-BASELINE.json; artifacts/sim/VS4-session2-health.json",
      "independent_of_author": true,
      "result": "pass",
      "verifier": "health.py"
    }
  ],
  "why_one_sentence": "the drill scored 1.0 in HANDOFF but could no longer write its criterion-4 receipt; the 149/149 suite stayed green because no test covered the call site (§3.3, I15)",
  "workstream": "agentic-core",
  "world": "prod"
}
