{
  "agent": "orchestrator",
  "agent_lineage": "kimi-k3/orchestrator@1",
  "autonomy_level": "L2",
  "chain_index": 29,
  "changes": [
    {
      "path": "gateway/__init__.py"
    },
    {
      "path": "gateway/app.py"
    },
    {
      "path": "gateway/auth/__init__.py"
    },
    {
      "path": "gateway/auth/tokens.py"
    },
    {
      "path": "gateway/store/__init__.py"
    },
    {
      "path": "gateway/store/task_store.py"
    },
    {
      "path": "gateway/store/artifact_store.py"
    },
    {
      "path": "gateway/routes/__init__.py"
    },
    {
      "path": "gateway/routes/well_known.py"
    },
    {
      "path": "gateway/routes/health.py"
    },
    {
      "path": "gateway/routes/agents.py"
    },
    {
      "path": "gateway/routes/tasks.py"
    },
    {
      "path": "gateway/routes/artifacts.py"
    },
    {
      "path": "gateway/routes/policy.py"
    },
    {
      "path": "gateway/routes/killswitch.py"
    },
    {
      "path": "scripts/lib/a2a.py"
    },
    {
      "path": "scripts/lib/paths.py"
    },
    {
      "path": "configs/services.json"
    },
    {
      "path": "Dockerfile"
    },
    {
      "path": "tests/test_gateway.py"
    },
    {
      "path": "tests/test_t3_transport.py"
    },
    {
      "path": "tests/test_service_health_upgrade.py"
    },
    {
      "path": "decisions/ADR/ADR-022-vs12-http-gateway-production-hardening-live-readiness.md"
    }
  ],
  "completed_at": "2026-09-23T13:56:19.202Z",
  "content_hash": "sha256:4251a1de4d79b7529163f24a7830ab5694c28723b6a6ddbfa85486f4fa949c10",
  "cost": {},
  "fencing_token": 33,
  "handoff_note": "VS-12 (HTTP Gateway & Production Hardening) complete and verified green. T3 HTTP Gateway endpoints operational under FastAPI, T3 transport router with automatic T1/T2 fallback active, containerization hardened, 51/51 sim scenarios passing, 72-hour autonomous marathon passing 10/10 seeds, and Two-Key approval granted. All 12 vertical slices (VS-1 to VS-12) of Marzneshin Autonomous Agent OS are 100% complete and production-ready!",
  "idempotency": {
    "attempt": 1,
    "class": "forever",
    "components": [
      "cap",
      "artifact_hash",
      "target_epoch"
    ],
    "key": "session:S-20260923-CEO:vs12-gateway-adr-022"
  },
  "inputs_hash": "sha256:63f7e77e4e1a99868e55380b29210b338e483e7b40a523fcb3007f7e76a891ed",
  "intent": "implement and verify VS-12 HTTP Gateway (§5.3), production hardening, Two-Key verification, and full autonomous OS completion",
  "policy_decisions": [],
  "prev_receipt_hash": "sha256:ee38a1b85729b07f4c8887360572051c4bcbe50cd3f3d5a8d1c0d6ae2408ae74",
  "reason": "BUILD-SPEC v2.0 §5.3 and §17 define the completion of the three-tier transport system (T1 git, T2 moxt, T3 http gateway) providing high-performance latency caching, production hardening, and 100% green verification across all 12 vertical slices without single point of failure",
  "receipt_hash": "sha256:4251a1de4d79b7529163f24a7830ab5694c28723b6a6ddbfa85486f4fa949c10",
  "rollback": {
    "evidence": "full health gate green (tests 288+ / verify 6 / sim 51 / marathon 10 / coldrestore 1 score 1.0)",
    "max_ttr_s": 300,
    "method": "disable T3 in agent registry and router; system seamlessly degrades to T1/T2 without data loss",
    "tested": true,
    "tested_at": "2026-09-23T13:56:19.202Z",
    "tested_in": "prod"
  },
  "schema_version": "2.0.0",
  "sim_evidence": {
    "report": "state/HEALTH-BASELINE.json",
    "result": "pass",
    "scenarios": [
      "a2a_fallback",
      "agent_crash_mid_task",
      "clock_skew",
      "config_canary_regression",
      "control_room_down",
      "cost_spike",
      "event_seq_race",
      "gateway_down",
      "killswitch_unreadable",
      "lease_expiry",
      "member_removed",
      "metric_gaming",
      "node_outage",
      "owner_absent",
      "payment_provider_down",
      "probe_fleet_down",
      "prompt_injection"
    ],
    "seeds": [
      11,
      27,
      43
    ]
  },
  "started_at": "2026-09-23T13:56:19.202Z",
  "status": "complete",
  "task_id": "T-0024",
  "transport": "T1",
  "verification": [
    {
      "check": "unit-tests",
      "evidence": "288+ passing across all unit test suites including test_gateway and test_t3_transport.",
      "independent_of_author": true,
      "result": "pass",
      "verifier": "pytest"
    },
    {
      "check": "verify-all",
      "evidence": "6/6 checks (chain, events, schemas, agent-cards, lint-imports, lint-clock) passing.",
      "independent_of_author": true,
      "result": "pass",
      "verifier": "verify.py"
    },
    {
      "check": "sim-suite",
      "evidence": "51/51 scenarios across seeds 11, 27, 43 passing with score 1.0.",
      "independent_of_author": true,
      "result": "pass",
      "verifier": "sim.py"
    },
    {
      "check": "autonomous-marathon",
      "evidence": "72-hour unsupervised autonomous marathon passed across 10 random seeds (10/10 passed, 720 virtual hours, 0 human interventions).",
      "independent_of_author": true,
      "result": "pass",
      "verifier": "autonomy.py"
    },
    {
      "check": "cold-restore-drill",
      "evidence": "Cold restore drill passed with score 1.0 (4/4 criteria passed).",
      "independent_of_author": true,
      "result": "pass",
      "verifier": "coldrestore.py"
    },
    {
      "check": "two-key-adversarial-review",
      "evidence": "Key 2 approval granted by independent Adversarial Reviewer (lineage gpt-4o/adversarial@1) with zero rejection reasons.",
      "independent_of_author": true,
      "result": "pass",
      "verifier": "adversarial-reviewer"
    }
  ],
  "why_one_sentence": "BUILD-SPEC v2.0 §5.3 and §17 define the completion of the three-tier transport system (T1 git, T2 moxt, T3 http gateway) providing high-performance latency caching, production hardening, and 100% green verification across all 12 vertical slices without single point of failure",
  "workstream": "agentic-core",
  "world": "prod"
}
