{
  "agent": "momo",
  "agent_lineage": "kimi-k3/momo@1",
  "autonomy_level": "L2",
  "chain_index": 9,
  "changes": [
    {
      "path": "scripts/lib/events.py"
    },
    {
      "path": "scripts/lib/paths.py"
    },
    {
      "path": "scripts/lib/deadman.py"
    },
    {
      "path": "scripts/anomaly.py"
    },
    {
      "path": "scripts/coldrestore.py"
    },
    {
      "path": "scripts/verify.py"
    },
    {
      "path": "scripts/compact.py"
    },
    {
      "path": "scripts/sim.py"
    },
    {
      "path": "sim/actors.py"
    },
    {
      "path": "sim/chaos.py"
    },
    {
      "path": "sim/report.py"
    },
    {
      "path": "sim/scenarios/event_seq_race.yaml"
    },
    {
      "path": "sim/scenarios/killswitch_unreadable.yaml"
    },
    {
      "path": "sim/scenarios/owner_absent.yaml"
    },
    {
      "path": "analytics/schemas/event.schema.json"
    },
    {
      "path": "tests/test_lib.py"
    },
    {
      "path": "tests/test_sim.py"
    },
    {
      "path": "decisions/ADR/ADR-006-vs4-continuity-decisions.md"
    },
    {
      "path": "state/events/_anomalies.json"
    },
    {
      "path": "state/archive/drills/cold-restore-2026-07-30T143639Z.json"
    },
    {
      "path": "state/archive/drills/cold-restore-2026-07-30T144110Z.json"
    }
  ],
  "completed_at": "2026-07-30T14:46:11.383Z",
  "content_hash": "sha256:68f2183cbd291af3c827e54d1813622772df5c460df1ec33484833dca7c14d0e",
  "cost": {},
  "fencing_token": 7,
  "handoff_note": "VS-4 in progress: seq race fixed + registry + dead-man + cold restore green; succession workflow + escrow + O4 OOB remain",
  "idempotency": {
    "attempt": 1,
    "class": "forever",
    "components": [
      "cap",
      "artifact_hash",
      "target_epoch"
    ],
    "key": "session:S-135341:vs4-first-increment"
  },
  "inputs_hash": "sha256:d07919bdabb27ec23a2f146354614da599828057865f7b2a54e3aff9dab26fe1",
  "intent": "VS-4 first increment: fix the prod actor_seq race (flock), ADR-cited anomaly registry, dead-man switch lib + gate, and the scored cold-restore drill — plus 3 new regression scenarios",
  "policy_decisions": [],
  "prev_receipt_hash": "sha256:5741b6a9cd9770c9c963977f2fb3068ba6961ba35c1ac05d2cb67b5272959766",
  "reason": "session opened with verify RED from the 2026-07-30 qa-gate seq collision; VS-4 DoD needs unreadable-halt, dead-man and cold restore proven in sim before any real-user contact (§17)",
  "receipt_hash": "sha256:68f2183cbd291af3c827e54d1813622772df5c460df1ec33484833dca7c14d0e",
  "rollback": {
    "evidence": "full gate suite re-run green after every edit",
    "max_ttr_s": 300,
    "method": "all changes are additive repo edits + script-written state; rollback = revert this session's file set; no external system was mutated (no pricing/ToS/infra/iam paths touched)",
    "tested": true,
    "tested_at": "2026-07-30T14:46:11.383Z",
    "tested_in": "prod"
  },
  "schema_version": "2.0.0",
  "sim_evidence": {
    "report": "artifacts/sim/VS4-session1.json",
    "result": "pass",
    "scenarios": [
      "event_seq_race",
      "killswitch_unreadable",
      "owner_absent"
    ],
    "seeds": [
      11,
      27,
      43
    ]
  },
  "started_at": "2026-07-30T13:50:00.000Z",
  "status": "complete",
  "task_id": "T-0009",
  "transport": "T1",
  "verification": [
    {
      "check": "unit-tests",
      "evidence": "python3 -m unittest discover -s tests -> Ran 148 tests, OK (incl. test_concurrent_emitters_never_duplicate_seq, test_anomaly_registry_explains_but_never_edits)",
      "independent_of_author": true,
      "result": "pass",
      "verifier": "unittest"
    },
    {
      "check": "sim-suite",
      "evidence": "scripts/sim.py run --all --seeds 11,27,43 -> 30/30 PASS (10 scenarios incl. event_seq_race, killswitch_unreadable, owner_absent; all score 1.0)",
      "independent_of_author": true,
      "result": "pass",
      "verifier": "sim-harness"
    },
    {
      "check": "verify-all",
      "evidence": "scripts/verify.py --all -> GREEN 6/6 (chain, events with 1 registered anomaly, schemas 26, agent-cards, lint-imports, lint-clock)",
      "independent_of_author": true,
      "result": "pass",
      "verifier": "verify.py"
    },
    {
      "check": "killswitch-drill",
      "evidence": "scripts/killswitch.py verify -> 10/10 (all five paths drilled)",
      "independent_of_author": true,
      "result": "pass",
      "verifier": "killswitch.py"
    },
    {
      "check": "cold-restore-drill",
      "evidence": "scripts/coldrestore.py run -> 4/4 criteria, score 1.0; archive state/archive/drills/cold-restore-2026-07-30T144110Z.json",
      "independent_of_author": true,
      "result": "pass",
      "verifier": "coldrestore.py"
    }
  ],
  "why_one_sentence": "session opened with verify RED from the 2026-07-30 qa-gate seq collision; VS-4 DoD needs unreadable-halt, dead-man and cold restore proven in sim before any real-user contact (§17)",
  "workstream": "agentic-core",
  "world": "prod"
}
